{
  "skill_hr_version": "2.0.0",
  "updated_at": "2026-04-04T12:00:00Z",
  "hosts": ["claude-code", "cursor"],
  "matching": {
    "delegate_min_score": 75,
    "confirm_band_min": 60,
    "max_trials_per_task_per_skill": 2
  },
  "skills": [
    {
      "id": "pdf",
      "name": "pdf",
      "install_path": "~/.claude/skills/pdf/SKILL.md",
      "description": "PDF manipulation toolkit for extraction, forms, and document workflows.",
      "keywords": ["pdf", "extract", "forms", "merge"],
      "status": "active",
      "added_at": "2026-04-01T10:00:00Z",
      "last_used_at": "2026-04-03T09:15:00Z",
      "tasks_total": 5,
      "tasks_success": 5,
      "tasks_fail": 0,
      "notes": "Reliable for extraction; not for scanned PDFs without OCR tool",
      "cc_scope": "user",
      "cc_invoke": "auto"
    },
    {
      "id": "experimental-foo",
      "name": "foo-beta",
      "source_url": "https://example.com/skills/foo",
      "description": "Experimental automation helper with weak CLI execution discipline.",
      "keywords": ["automation", "experimental"],
      "status": "on_probation",
      "added_at": "2026-04-02T14:00:00Z",
      "tasks_total": 2,
      "tasks_success": 0,
      "tasks_fail": 2,
      "notes": "Poor fit for CLI tasks; consider terminate if next task fails"
    }
  ],
  "employees": [
    {
      "id": "document-specialist",
      "name": "Document Specialist",
      "status": "active",
      "skills": ["pdf"],
      "primary_skill": "pdf",
      "host": "claude-code",
      "created_by": "migrated",
      "role_title": "Document operations employee",
      "added_at": "2026-04-01T10:00:00Z",
      "last_used_at": "2026-04-03T09:15:00Z",
      "source_skill_id": "pdf",
      "notes": "Derived from the legacy single-skill registry entry.",
      "performance": {
        "tasks_total": 5,
        "tasks_success": 5,
        "tasks_fail": 0
      },
      "training_history": [
        {
          "ts": "2026-04-01T10:00:00Z",
          "action": "migrated_from_skill",
          "notes": "Legacy skill entry promoted into an employee record."
        }
      ]
    },
    {
      "id": "automation-probationer",
      "name": "Automation Probationer",
      "status": "on_probation",
      "skills": ["experimental-foo"],
      "primary_skill": "experimental-foo",
      "host": "unknown",
      "created_by": "recruited",
      "role_title": "Experimental automation employee",
      "added_at": "2026-04-02T14:00:00Z",
      "source_skill_id": "experimental-foo",
      "notes": "Kept on probation while its workflow matures.",
      "performance": {
        "tasks_total": 2,
        "tasks_success": 0,
        "tasks_fail": 2
      },
      "training_history": [
        {
          "ts": "2026-04-02T14:00:00Z",
          "action": "hired",
          "notes": "Added for trial automation tasks."
        }
      ]
    }
  ]
}
